market_name,listing_title,price,dosage,rating,review,description,number_in_stocks,original_url,category_page,fetched_at,category,matched_categories,matched_terms,ship_from,ship_to,matched_terms,matched_categories
TorZon Market,OSELTAMIVIR (tamiflu) ANTIFLU 75mg 50 TABS,USD 95282.11,,4.88,,"Product Description Oseltamivir Why is this medication prescribed? Oseltamivir is used to treat some types of influenza infection ('flu') in adults, children, and infants (older than 2 weeks of age) who have had symptoms of the flu for no longer than 2 days. This medication is also used to prevent some types of flu in adults and children (older than 1 year of age) when they have spent time with someone who has the flu or when there is a flu outbreak. Oseltamivir is in a class of medications called neuraminidase inhibitors. It works by stopping the spread of the flu virus in the body. Oseltamivir helps shorten the time that flu symptoms such as a stuffy or runny nose, sore throat, cough, muscle or joint aches, tiredness, headache, fever, and chills last. Oseltamivir will not prevent bacterial infections, which may occur as a complication of the flu. How should this medicine be used? OSELTAMIVIR How should this medicine be used? Oseltamivir comes as a capsule and a suspension (liquid) to take by mouth. When oseltamivir is used to treat flu symptoms, it is usually taken two times a day (morning and evening) for 5 days. When oseltamivir is used to prevent flu, it is usually taken once a day for at least 10 days, or for up to 6 weeks during a community flu outbreak. Oseltamivir may be taken with or without food, but is less likely to cause upset stomach if it is taken with food or milk. Follow the directions on your prescription label carefully, and ask your doctor or pharmacist to explain any part that you do not understand. Take oseltamivir exactly as directed. Do not take more or less of it or take it more often than prescribed by your doctor. It is important to know the dose of medication your doctor has prescribed and to use a measuring device that will measure the dose accurately. If you are taking the medication yourself or giving it to a child older than 1 year of age, you can use the device provided by the manufacturer to measure the dose according to the instructions below. If you are giving the medication to a child under one year of age, you should not use the measuring device provided by the manufacturer because it cannot accurately measure small doses. Instead, use the device provided by your pharmacist. If the commercial suspension is unavailable and your pharmacist prepares a suspension for you, he or she will provide a device to measure your dose. Never use a household teaspoon to measure doses of oseltamivir oral suspension. If you are giving the commercial suspension to an adult or child over one year of age, follow these steps to measure the dose using the syringe provided: Shake the suspension well (for about 5 seconds) before each use to mix the medication evenly. Open the bottle by pushing down on the cap and turning the cap at the same time. Push the plunger of the measuring device completely down to the tip. Insert the tip of the measuring device firmly into the opening on the top of the bottle. Turn the bottle (with the measuring device attached) upside down. Pull back on the plunger slowly until the amount of suspension prescribed by your doctor fills the measuring device to the appropriate marking. Some larger doses may need to be measured using the measuring device twice. If you are not sure how to correctly measure the dose your doctor has prescribed, ask your doctor or pharmacist. Turn the bottle (with the measuring device attached) right-side up and slowly remove the measuring device. Take oseltamivir directly into your mouth from the measuring device; do not mix with any other liquids. Replace the cap on the bottle and close tightly. Remove the plunger from the rest of the measuring device and rinse both parts under running tap water. Allow the parts to air dry before putting back together for the next use. Call your doctor or pharmacist to find out how you should measure a dose of oseltamivir suspension if you do not have the measuring device that came with this medication. If you have difficulty swallowing capsules, your doctor may tell you to open the capsule and mix the contents with a sweetened liquid. To prepare doses of oseltamivir for people who cannot swallow the capsules: Hold the capsule over a small bowl and carefully pull open the capsule and empty all of the powder from the capsule into the bowl. If your doctor has instructed you to take more than one capsule for your dose, then open the correct number of capsules into the bowl. Add a small amount of sweetened liquid, such as regular or sugar-free chocolate syrup, corn syrup, caramel topping, or light brown sugar dissolved in water to the powder. Stir the mixture. Swallow the entire contents of this mixture right away. Continue to take oseltamivir until you finish the prescription, even if you start to feel better. Do not stop taking oseltamivir without talking to your doctor. If you stop taking oseltamivir too soon or skip doses, your infection may not be fully treated, or you may not be protected from the flu. If you feel worse or develop new symptoms while taking oseltamivir, or if your flu symptoms do not start to get better, call your doctor. Ask your pharmacist or doctor for a copy of the manufacturer's information for the patient. Other uses for this medicine Oseltamivir may be used to treat and prevent infections from avian (bird) influenza (a virus that usually infects birds but can also cause serious illness in humans). Oseltamivir also may be used to treat and prevent infections from influenza A (H1N1). This medication may be prescribed for other uses; ask your doctor or pharmacist for more information. What special precautions should I follow? Before taking oseltamivir, tell your doctor and pharmacist if you are allergic to oseltamivir, any other medications, or any of the ingredients in oseltamivir capsules or suspension. Ask your pharmacist or check the manufacturer's patient information for a list of the ingredients. tell your doctor what prescription and nonprescription medications, vitamins, nutritional supplements and herbal products you are taking or plan to take. Be sure to mention any of the following: medications that affect the immune system such as azathioprine (Imuran); cyclosporine (Neoral, Sandimmune); cancer chemotherapy medications; methotrexate (Rheumatrex); sirolimus (Rapamune); oral steroids such as dexamethasone (Decadron, Dexone), methylprednisolone (Medrol), and prednisone (Deltasone); or tacrolimus (Prograf). Your doctor may need to change the doses of your medications or monitor you carefully for side effects. tell your doctor if you have ever taken oseltamivir to treat or prevent the flu. tell your doctor if you have any disease or condition that affects your immune system such as human immunodeficiency virus (HIV) or acquired immunodeficiency syndrome (AIDS) or if you have heart, lung, or kidney disease. tell your doctor if you are pregnant, plan to become pregnant, or are breast-feeding. If you become pregnant while taking oseltamivir, call your doctor. you should know that people, especially children and teenagers, who have the flu may become confused, agitated, or anxious, and may behave strangely, have seizures or hallucinate (see things or hear voices that do not exist), or harm or kill themselves. You or your child may develop these symptoms whether or not you or your child uses oseltamivir, and the symptoms may begin shortly after starting treatment if you do use the medication. If your child has the flu, you should watch his or her behavior very carefully and call the doctor right away if he or she becomes confused or behaves abnormally. If you have the flu, you, your family, or your caregiver should call the doctor right away if you become confused, behave abnormally, or think about harming yourself. Be sure that your family or caregiver knows which symptoms may be serious so they can call the doctor if you are unable to seek treatment on your own. ask your doctor if you should receive a flu vaccination each year. Oseltamivir does not take the place of a yearly flu vaccine. If you received or plan to receive the intranasal flu vaccine (FluMist; flu vaccine that is sprayed into the nose), you should tell your doctor before taking oseltamivir. Oseltamivir may make the intranasal flu vaccine less effective if it is taken up to 2 weeks after or up to 48 hours before the intranasal flu vaccine is given. if you have fructose intolerance (an inherited condition in which the body lacks the protein needed to break down fructose, a fruit sugar, such as sorbitol), you should know that the oseltamivir suspension is sweetened with sorbitol. Tell your doctor if you have fructose intolerance. What should I do if I forget a dose? If you forget to take a dose, take it as soon as you remember it. If it is no longer than 2 hours before your next scheduled dose, skip the missed dose and continue your regular dosing schedule. If you miss several doses, call your doctor for directions. Do not take a double dose to make up for a missed one. PLEASE CHECK MY VENDOR PROFILE FOR REFUND RULES. SHIPPING RESTRICTIONS AND TERMS AND CONDITIONS.",,http://torzon4dstyuo4waiwy5lgmgsqjjqcdk2pwbwdvkmg4isobc7ufbqgyd.onion/products.php?action=view&id=5197235729&pid=35785&fid=23722131188,http://torzon4dstyuo4waiwy5lgmgsqjjqcdk2pwbwdvkmg4isobc7ufbqgyd.onion/products.php?page=66&sta=1&searchword=&shipsfrom=All&payment=All&category=Pharmaceuticals&small=0&big=5000000&id=85313615311066502,2025-11-15T20:57:30+00:00,Pharmaceuticals,abortion_meds,Methotrexate,India,WorldWide,Methotrexate,abortion_meds
TorZon Market,28 Tabs Kamagra Oral Jelly 100mg,USD 95323.99,,4.84,,"Product Description Hello dear GreenLeafDE-members, we offer you exclusive oral jelly kamagra packs for a hard, stiff night. Flavour: Orange, Vanilla, Pineapple, Strawberry, Butterscottch, Black Currant What is Kamagra Oral Jelly? Kamagra Oral Jelly is a sexual enhancer made by the Indian pharmaceutical company Ajanta Pharma. It is a generic version of Viagra, which according to the manufacturer, like the original drug, should contain the active ingredient sildenafil. Oral jelly means something like “gel to take in”. There are many different websites that sell these jellies, but the most common is Kamagra Oral Jelly. One of the alleged advantages of the jelly is that its consistency makes it easy to take without water. In addition, the natural taste is more pleasant than with tablets. It is often promised that Kamagra Oral Jelly has a preferential onset of action, since the active ingredient is absorbed directly through the oral mucosa. --------------------------------------------------- ------------------------------------------------------------ --- > Allgemeine-Infos zu uns: ---------------------------------- - Unsere Qualität und Kundenservice steht an höchster Stelle. - Faires Preis-Leistungs Verhältnis. - Unsere meisten Cannabis-Strains werden aus Holland importiert. - Wir verkaufen nur TOP Ware. - Verpackung und Versand per DHL. - Nachrichten werden innerhalb 8 Stunden beantwortet. ---------------------------------- > ADRESSFORMAT ---------------------------------- Vorname Nachname Straße Hausnummer Postleitzahl Ort Land - Schreibt bitte Umlaute in der Adresse aus. - Überprüft eure Adresse doppelt auf mögliche Rechtschreibfehler BEVOR ihr sie uns sendet. --------------------------------------------------- ----------------------------------------------------------- SMELL, TASTE AND EFFECT OF SUPER SILVER HAZE Super Silver Haze is known for its intense sweet and slightly spicy aroma. The sweet Skunk taste, earthy Haze and strong Afghani flavors of Northern Lights are magically combined. It actually tastes exactly the same as it smells, namely fantastic! With the heavy, yet sweet tasting smoke, it's no wonder this strain is so popular. The Super Silver Haze's high is functional and perfect for daytime use. You are full of energy and still feel extremely peaceful, grounded and clear in your head. The perfect strain for that morning joint. Not to forget its potential for treating headaches/migraines and anxiety. -------------------------------------------------- ------------------------------------------------------------ ---- ________________________________ > General information about us: ---------------------------------- - Our quality and customer service is our top priority. - Fair price-performance ratio. - Most of our cannabis strains are imported from Holland. - We only sell TOP merchandise. - Packaging and shipping by DHL. - Messages will be answered within 8 hours. ---------------------------------- > ADDRESS FORMAT ---------------------------------- First name Last name Street House number Zip code City Country - Please write out umlauts in the address. - Check your address twice for possible spelling mistakes BEFORE you send it to us. Meine Lichtbrüder, es gibt sonnengeküsste Nachrichten, welche eine Flut auslöse. Sicherheit: Bitte achtet immer darauf mir eure Adressen verschlüsselt zuzusenden! Hierfür solltet ihr euch mit der PGP-Verschlüsselung vertraut machen. Zwar werden die Daten bei uns in speziell dafür gemachten Betriebssystemen abgerufen ect. Trotzdem sollte euch eure Sicherheit auch wichtig sein. Versand: Beim Versand steht bei uns Sicherheit an erster Stelle. Die Ware ist vakuumiert, tast und blickdicht verpackt, sodass euch selbst bei Beschaedigung der Sendung niemand Verdacht hegen wird. Versendet wird bei uns von Montag bis Samstag. Das Adressformat ist wie folgt zu gestalten Max Mustermann Musterstrasse 123 12345 Berlin Deutschland DE= 2 Werktage EU= 3-5 Werktage Kein Tracking. (OPSec) Qualitätsversprechen unseres Shops: Da wir sehr viel Wert auf Kommunikation und Kundenservice legen, scheut euch nicht uns offene Fragen zu stellen. Normalerweise antworten wir innerhalb von 12Stunden an Werktagen. Bisher sind all unsere Sendungen angekommen und haben noch jeden glücklich gemacht. Falls das aber bei dir tatsächlich mal nicht der Fall sein sollte, wende dich bitte direkt an uns und wir finden eine Lösung. Das hilft uns beiden mehr, als das hinterlassen eines schlechten Feedbacks. Sollten jetzt noch abschließende Fragen offen geblieben sein, sind wir für dich per PM erreichbar. Reklamationen / Refund / Reship? ? Ruhe bewahren! ? Nehmt Kontakt mit uns auf und wir finden eine Möglichkeit. Wir sind auch nur Menschen. ? Refund / Reship gibt es nur, wenn ein Versäumnis unsererseits vorliegt. ? Kein Reship für Auslandssendungen. Für Neukunden gibt es leider kein Reship. ? Bestellung immer auf eigene Gefahr. ? Maximum Reship 50% Wir versuchen stets unser bestes zu geben, Versprochen! ______________________________________________ ______________ My brothers of light, there is sun-kissed news, which is causing a flood. Security: Please always make sure to send me your addresses encrypted! For this, you should familiarize yourself with PGP encryption. Although the data is retrieved from us in specially designed operating systems ect. Nevertheless, your security should also be important to you. Shipping: For shipping, security is our first priority. The goods are packed vacuumed, tast and opaque, so that even if the shipment is damaged, no one will suspect you. We ship from Monday to Saturday. The address format is as follows Max Mustermann Sample street 123 12345 Berlin Germany DE= 2 working days EU= 3-5 working days No tracking. (OPSec) Quality promise of our store: Since we put a lot of emphasis on communication and customer service, don't be afraid to ask us open questions. We usually reply within 12 hours on working days. So far, all our shipments have arrived and made everyone happy. If this is not the case for you, please contact us directly and we will find a solution. This helps both of us more than leaving a bad feedback. If you still have questions, you can reach us via PM. Complaints / Refund / Reship? ? Keep calm! ? Contact us and we will find a way. We are only human. ? Refund / Reship is only available if there is an omission on our part. ? No reship for foreign shipments. Unfortunately there is no reship for new customers. ? Order always at your own risk. ? Maximum Reship 50% After 3 years, making thousands of brothers happy on all Plattforms, we got News ! there is a maximum reship of 30 to 50 percent. and only in the case of sympathy. (with cocaine there is no reship/refund)!!! UPDATE 01.10.2022 We always try our best to give, promised!",,http://torzon4dstyuo4waiwy5lgmgsqjjqcdk2pwbwdvkmg4isobc7ufbqgyd.onion/products.php?action=view&id=3380068541&pid=4453&fid=19786230900,http://torzon4dstyuo4waiwy5lgmgsqjjqcdk2pwbwdvkmg4isobc7ufbqgyd.onion/products.php?page=68&sta=1&searchword=&shipsfrom=All&payment=All&category=Pharmaceuticals&small=0&big=5000000&id=85313615311066502,2025-11-15T21:00:58+00:00,Pharmaceuticals,contraceptives,Advantage S,Germany,WorldWide,Advantage S,contraceptives
TorZon Market,loette 84 tablets,USD 95423.75,,4.81,,"Product Description loette (generic ethinylestradiol and levonorgestrel) 42 tablets Active ingredient: Ethinylestradiol Active ingredient: Levonorgestrel Dosage: 0.02mg Ethinylestradiol + 0.1mg Levonorgestrel Form: Tablets Short description: Combined birth control pill made up of ethinylestradiol, an estrogen and levonorgestrel a progestin. Long description: It is used for birth control, symptoms of menstruation, endometriosis, and as emergency contraception. Ethinylestradiol/levonorgestrel has been approved for medical use in the United States at least since 1982. It is on the World Health Organizations List of Essential Medicines. Shipping Timings: USA-9 TO 12 Days UK-3 To 6 Days Australia-5 To 8 Days France-7 To 9 days Rest Of World-12 to 14 Days",,http://torzon4dstyuo4waiwy5lgmgsqjjqcdk2pwbwdvkmg4isobc7ufbqgyd.onion/products.php?action=view&id=7813895853&pid=98746&fid=90210033543,http://torzon4dstyuo4waiwy5lgmgsqjjqcdk2pwbwdvkmg4isobc7ufbqgyd.onion/products.php?page=74&sta=1&searchword=&shipsfrom=All&payment=All&category=Pharmaceuticals&small=0&big=5000000&id=85313615311066502,2025-11-15T21:34:19+00:00,Pharmaceuticals,contraceptives,Birth Control; Contraception; Estrogen; Ethinyl estradiol; Levonorgestrel; Progestin; ethinylestradiol,India,WorldWide,Birth Control; Contraception; Estrogen; Ethinyl estradiol; Levonorgestrel; Progestin; ethinylestradiol,contraceptives
TorZon Market,abortab 200mg (generic mifepristone) 10 tablets,USD 95466.98,,4.81,,Product Description abortab 200mg Shipping Timings: USA-9 TO 12 Days UK-3 To 6 Days Australia-5 To 8 Days France-7 To 9 days Rest Of World-12 to 14 Days,,http://torzon4dstyuo4waiwy5lgmgsqjjqcdk2pwbwdvkmg4isobc7ufbqgyd.onion/products.php?action=view&id=6110165374&pid=98723&fid=8000644122,http://torzon4dstyuo4waiwy5lgmgsqjjqcdk2pwbwdvkmg4isobc7ufbqgyd.onion/products.php?page=76&sta=1&searchword=&shipsfrom=All&payment=All&category=Pharmaceuticals&small=0&big=5000000&id=85313615311066502,2025-11-15T21:38:01+00:00,Pharmaceuticals,abortion_meds,Mifepristone,India,WorldWide,Mifepristone,abortion_meds
TorZon Market,vilapad 20mg (generic vilazodone) 50 tablets,USD 95338.79,,4.81,,"Product Description Vilapad 20mg Active ingredient: Vilazodone Dosage: 20mg Form: Tablets Short description: Medication used to treat major depressive disorder. It is classified as a serotonin modulator. Long description: Seven controlled efficacy trials were conducted of vilazodone for treatment of major depressive disorder (MDD). Five of these trials showed no significant influence of vilazodone over placebo on depressive symptoms. In the remaining two trials, small but significant advantages of vilazodone over placebo were found. According to these two eight-week trials in adults, vilazodone has an antidepressant response after one week of treatment. Shipping Timings: USA-9 TO 12 Days UK-3 To 6 Days Australia-5 To 8 Days France-7 To 9 days Rest Of World-12 to 14 Days",,http://torzon4dstyuo4waiwy5lgmgsqjjqcdk2pwbwdvkmg4isobc7ufbqgyd.onion/products.php?action=view&id=7596291545&pid=97890&fid=57279420046,http://torzon4dstyuo4waiwy5lgmgsqjjqcdk2pwbwdvkmg4isobc7ufbqgyd.onion/products.php?page=78&sta=1&searchword=&shipsfrom=All&payment=All&category=Pharmaceuticals&small=0&big=5000000&id=85313615311066502,2025-11-15T21:51:09+00:00,Pharmaceuticals,contraceptives,Advantage S,India,WorldWide,Advantage S,contraceptives
TorZon Market,estraheal 2mg (generic estradiol) 56 tablets,USD 95190.51,,4.81,,"Product Description Estraheal 2mg Active ingredient: Estradiol Dosage: 2mg Form: Tablets 1 blister contains 28 tablets Short description: Medication used mainly in menopausal hormone therapy and to treat low sex hormone levels in women. Long description: Estradiol is a naturally occurring and bioidentical estrogen, or an agonist of the estrogen receptor, the biological target of estrogens like endogenous estradiol. Due to its estrogenic activity, estradiol has antigonadotropic effects and can inhibit fertility and suppress sex hormone production in both women and men. Estradiol differs from non-bioidentical estrogens like conjugated estrogens and ethinylestradiol in various ways, with implications for tolerability and safety. Shipping Timings: USA-9 TO 12 Days UK-3 To 6 Days Australia-5 To 8 Days France-7 To 9 days Rest Of World-12 to 14 Days",,http://torzon4dstyuo4waiwy5lgmgsqjjqcdk2pwbwdvkmg4isobc7ufbqgyd.onion/products.php?action=view&id=4512536917&pid=98789&fid=59697470271,http://torzon4dstyuo4waiwy5lgmgsqjjqcdk2pwbwdvkmg4isobc7ufbqgyd.onion/products.php?page=79&sta=1&searchword=&shipsfrom=All&payment=All&category=Pharmaceuticals&small=0&big=5000000&id=85313615311066502,2025-11-15T21:53:27+00:00,Pharmaceuticals,contraceptives,Estradiol; Estrogen; Estrogens; Ethinyl estradiol; ethinylestradiol,India,WorldWide,Estradiol; Estrogen; Estrogens; Ethinyl estradiol; ethinylestradiol,contraceptives
TorZon Market,EXEMESTANE (Aromasin) XTANE 25mg pills 30TABS box,USD 95214.55,,4.88,,"Product Description Uses This medication is used to treat certain types of breast cancer (such as hormone-receptor-positive breast cancer) in women after menopause. Exemestane is also used to help prevent the cancer from returning. Some breast cancers are made to grow faster by a natural hormone called estrogen. Exemestane decreases the amount of estrogen the body makes and helps to slow or reverse the growth of these breast cancers.Exemestane is usually not used in women of childbearing age. How to use Exemestane 25 Mg Tablet Aromatase Inhibitors Read the Patient Information Leaflet provided by your pharmacist before you start using exemestane and each time you get a refill. If you have any questions, consult your doctor or pharmacist. Take this medication by mouth, usually once daily with food (after a meal), or as directed by your doctor. Dosage is based on your medical condition, response to treatment, and other medications you may be taking. Be sure to tell your doctor and pharmacist about all the products you use (including prescription drugs, nonprescription drugs, and herbal products). Use this medication regularly to get the most benefit from it. To help you remember, take it at the same time each day. Since this drug can be absorbed through the skin and lungs, women who are pregnant or who may become pregnant should not handle this medication or breathe the dust from the tablets. (See also Precautions section.) Inform your doctor right away if your condition worsens (such as you get new breast lumps). PLEASE CHECK MY VENDOR PROFILE FOR REFUND RULES. SHIPPING RESTRICTIONS AND TERMS AND CONDITIONS.",,http://torzon4dstyuo4waiwy5lgmgsqjjqcdk2pwbwdvkmg4isobc7ufbqgyd.onion/products.php?action=view&id=6892967045&pid=35940&fid=66674086490,http://torzon4dstyuo4waiwy5lgmgsqjjqcdk2pwbwdvkmg4isobc7ufbqgyd.onion/products.php?page=80&sta=1&searchword=&shipsfrom=All&payment=All&category=Pharmaceuticals&small=0&big=5000000&id=85313615311066502,2025-11-15T21:54:26+00:00,Pharmaceuticals,contraceptives,Estrogen,India,WorldWide,Estrogen,contraceptives
TorZon Market,100 pills Cytotec Misoprostol 200mcg,USD 95385.73,,4.83,,"Product Description 100 pills Cytotec Misoprostol 200mcg ONLY 59$ usd !!! DELIVERY GUARANTEED !!! Misoprostol reduces stomach acid and helps protect the stomach lining from damage that can be caused by taking aspirin or a nonsteroidal anti-inflammatory drug (NSAID). Misoprostol is a synthetic prostaglandin that works by ""replacing"" prostaglandins whose production is blocked by aspirin or NSAIDs. It is used to prevent stomach ulcers from developing during treatment with aspirin or an NSAID. Examples of NSAIDs include ibuprofen (Advil, Motrin), naproxen (Aleve), celecoxib, diclofenac, indomethacin, and meloxicam. Misoprostol is used in a hospital setting to induce cervical ripening, labor induction in women with premature rupture of membranes, and treatment of serious post-partum hemorrhage, These uses are outside of the approved indications. Misoprostol is also in combination with mifepristone or methotrexate to end an early pregnancy (medical abortion) or alone for early pregnancy loss (miscarriage). medsguru,",,http://torzon4dstyuo4waiwy5lgmgsqjjqcdk2pwbwdvkmg4isobc7ufbqgyd.onion/products.php?action=view&id=6986276195&pid=74261&fid=76938293669,http://torzon4dstyuo4waiwy5lgmgsqjjqcdk2pwbwdvkmg4isobc7ufbqgyd.onion/products.php?page=81&sta=1&searchword=&shipsfrom=All&payment=All&category=Pharmaceuticals&small=0&big=5000000&id=85313615311066502,2025-11-15T22:12:41+00:00,Pharmaceuticals,abortion_meds,Abortion; Cytotec; Methotrexate; Mifepristone; Misoprostol,India,WorldWide,Abortion; Cytotec; Methotrexate; Mifepristone; Misoprostol,abortion_meds
