market_name,listing_title,price,dosage,rating,review,description,number_in_stocks,original_url,category_page,fetched_at,category,matched_categories,matched_terms,ship_from,ship_to,matched_terms,matched_categories
TorZon Market,vilapad 20mg (generic vilazodone) 50 tablets,USD 95873.89,,4.81,,"Product Description Vilapad 20mg Active ingredient: Vilazodone Dosage: 20mg Form: Tablets Short description: Medication used to treat major depressive disorder. It is classified as a serotonin modulator. Long description: Seven controlled efficacy trials were conducted of vilazodone for treatment of major depressive disorder (MDD). Five of these trials showed no significant influence of vilazodone over placebo on depressive symptoms. In the remaining two trials, small but significant advantages of vilazodone over placebo were found. According to these two eight-week trials in adults, vilazodone has an antidepressant response after one week of treatment. Shipping Timings: USA-9 TO 12 Days UK-3 To 6 Days Australia-5 To 8 Days France-7 To 9 days Rest Of World-12 to 14 Days",,http://torzon4dstyuo4waiwy5lgmgsqjjqcdk2pwbwdvkmg4isobc7ufbqgyd.onion/products.php?action=view&id=8234138165&pid=97890&fid=33004372216,http://torzon4dstyuo4waiwy5lgmgsqjjqcdk2pwbwdvkmg4isobc7ufbqgyd.onion/products.php?page=86&sta=1&searchword=&shipsfrom=All&payment=All&category=Pharmaceuticals&small=0&big=5000000&id=85313615311066502,2025-11-16T05:00:32+00:00,Pharmaceuticals,contraceptives,Advantage S,India,WorldWide,Advantage S,contraceptives
TorZon Market,biovorin 15mg (generic leucovorin) 60 tablets,USD 95873.89,,4.81,,"Product Description Biovorin 15mg Active ingredient: Folinic acid Dosage: 15mg Form: tablets Short description: medication used to decrease the toxic effects of methotrexate and pyrimethamine. It is also used in combination with 5-fluorouracil to treat colorectal cancer and pancreatic cancer, may be used to treat folate deficiency that results in anemia, and methanol poisoning. Long description: Folinic acid is administered after methotrexate as part of a comprehensive chemotherapy regimen to help prevent bone marrow suppression and inflammation of the gastrointestinal mucosa. However, no apparent effect is seen on pre-existing methotrexate-induced nephrotoxicity. It is also used in combination with the chemotherapy agent 5-fluorouracil in treating colon cancer. In this case, folinic acid is not used for ""rescue"" purposes; rather, it enhances the effect of 5-fluorouracil by inhibiting thymidylate synthase. Folinic acid is also sometimes used to prevent toxic effects of high doses of antimicrobial dihydrofolate reductase inhibitors such as trimethoprim and pyrimethamine, although its value for this indication has not been clearly established. It may be prescribed in the treatment of toxoplasmosis retinitis, in combination with the folic acid antagonists pyrimethamine and sulfadiazine. Folinic acid is also used in the treatment of cerebral folate deficiency, a syndrome in which the use of folic acid cannot normalize cerebrospinal fluid levels of 5-MTHF. In pyridoxine-dependent epilepsy, folinic acid may be used as additional therapy if pyridoxine or pyridoxal phosphate fails to fully control the seizures. Shipping Timings: USA-9 TO 12 Days UK-3 To 6 Days Australia-5 To 8 Days France-7 To 9 days Rest Of World-12 to 14 Days",,http://torzon4dstyuo4waiwy5lgmgsqjjqcdk2pwbwdvkmg4isobc7ufbqgyd.onion/products.php?action=view&id=1182053326&pid=98443&fid=660153879,http://torzon4dstyuo4waiwy5lgmgsqjjqcdk2pwbwdvkmg4isobc7ufbqgyd.onion/products.php?page=86&sta=1&searchword=&shipsfrom=All&payment=All&category=Pharmaceuticals&small=0&big=5000000&id=85313615311066502,2025-11-16T05:01:33+00:00,Pharmaceuticals,abortion_meds,Methotrexate,India,WorldWide,Methotrexate,abortion_meds
TorZon Market,Armodafinil 150mg x 10 (Blister pack of 10),USD 94327.13,,4.98,,"Product Description Armodafinil 150mg is a medication classified as a wakefulness-promoting agent (also known as a eugeroic). It is primarily prescribed to improve wakefulness in adults who experience excessive sleepiness due to certain conditions: Narcolepsy: A chronic neurological condition characterized by overwhelming daytime sleepiness and sudden attacks of sleep. Obstructive Sleep Apnea (OSA): A sleep disorder where breathing repeatedly stops and starts during sleep, leading to disrupted sleep and daytime sleepiness. For OSA, Armodafinil is used in addition to other treatments like Continuous Positive Airway Pressure (CPAP). Shift Work Sleep Disorder (SWSD): A condition affecting individuals who work non-traditional hours (e.g., night shifts, rotating shifts), leading to difficulty sleeping during scheduled sleep times and excessive sleepiness during waking hours. How it works: The exact mechanism of action is not fully understood, but it is believed to work by affecting certain natural substances (neurotransmitters) in the brain, particularly by inhibiting the reuptake of dopamine. This leads to increased levels of dopamine in the brain, which helps promote wakefulness. Dosage and Administration: For narcolepsy and OSA, the typical dose is 150 mg to 250 mg taken once a day in the morning. For shift work sleep disorder, 150 mg is usually taken about an hour before the start of the work shift. It can be taken with or without food. Important Considerations: Armodafinil does not cure these sleep disorders, but rather helps manage the symptom of excessive sleepiness. It is a Schedule IV controlled substance due to its potential for misuse and dependence. Patients should continue with other prescribed treatments for their underlying sleep disorder (e.g., CPAP for OSA) while taking armodafinil. It can affect judgment, thinking, and movement, so caution is advised when driving or operating machinery. It may reduce the effectiveness of hormonal contraceptives, so alternative or additional non-hormonal birth control methods should be considered.",,http://torzon4dstyuo4waiwy5lgmgsqjjqcdk2pwbwdvkmg4isobc7ufbqgyd.onion/products.php?action=view&id=6494421095&pid=79792&fid=44607559360,http://torzon4dstyuo4waiwy5lgmgsqjjqcdk2pwbwdvkmg4isobc7ufbqgyd.onion/products.php?page=93&sta=1&searchword=&shipsfrom=All&payment=All&category=Pharmaceuticals&small=0&big=5000000&id=85313615311066502,2025-11-16T20:17:31+00:00,Pharmaceuticals,contraceptives,Birth Control,Australia,WorldWide,Birth Control,contraceptives
TorZon Market,premarin 0.625mg 56 tablets,USD 94293.35,,4.82,,"Product Description premarin 0.625mg (generic conjugated estrogens) 56 tablets Premarin 0.625mg Active ingredient: Conjugated estrogens (CEs) or conjugated equine estrogens (CEEs) Dosage: 0.625mg Form: Tablets 1 blister contains 28 tablets Short description: Estrogen medication which is used in menopausal hormone therapy and for various other indications. It is a mixture of the sodium salts of estrogen conjugates found in horses, such as estrone sulfate and equilin sulfate Long description: CEEs are a form of hormone therapy used in women. It is used most commonly in postmenopausal women who have had a hysterectomy to treat hot flashes, and burning, itching, and dryness of the vagina and surrounding areas. CEEs must be used in combination with a progestogen in women who have not had a hysterectomy. For women already taking the medication, it can be used to treat osteoporosis, although it is not recommended solely for this use. Some lesser known uses are as a means of high dose estrogen therapy in the treatment of breast cancer in both women and men and in the treatment of prostate cancer in men. It has been used at a dosage of 2.5mg three times per day (7.5mg/day total) for prostate cancer. CEEs are specifically approved in countries such as the United States and Canada for the treatment of moderate to severe vasomotor symptoms (hot flashes) and vulvovaginal atrophy (atrophic vaginitis, atrophic urethritis) associated with menopause, hypoestrogenism due to hypogonadism, ovariectomy, or primary ovarian failure, abnormal uterine bleeding, the palliative treatment of metastatic breast cancer in women, the palliative treatment of advanced androgen dependent prostate cancer in men, and the prevention of postmenopausal osteoporosis. The intravenous formulation of CEEs is specifically used to rapidly limit bleeding in women with hemorrhage due to dysfunctional uterine bleeding. Shipping Timings: USA-9 TO 12 Days UK-3 To 6 Days Australia-5 To 8 Days France-7 To 9 days Rest Of World-12 to 14 Days",,http://torzon4dstyuo4waiwy5lgmgsqjjqcdk2pwbwdvkmg4isobc7ufbqgyd.onion/products.php?action=view&id=2126064911&pid=98818&fid=52692822557,http://torzon4dstyuo4waiwy5lgmgsqjjqcdk2pwbwdvkmg4isobc7ufbqgyd.onion/products.php?page=98&sta=1&searchword=&shipsfrom=All&payment=All&category=Pharmaceuticals&small=0&big=5000000&id=85313615311066502,2025-11-16T20:58:14+00:00,Pharmaceuticals,contraceptives,Estrogen; Estrogens,India,WorldWide,Estrogen; Estrogens,contraceptives
TorZon Market,Arimidex (ANASTRAZOLE) 1MG X 28 TABS,USD 94148.12,,4.97,,"Product Description This listing is for genuine Arimidex (ANASTRAZOLE) 1MG X 28 TABS pharma stock. Arimidex is the brand name for anastrozole. Doctors may prescribe the drug to postmenopausal women with certain types of breast cancer. Arimidex stops aromatase from working in the body. Aromatase is an enzyme that makes estrogen from steroid hormones, including testosterone. By doing this, it lowers the amount of estrogen in the body. People who use anabolic steroids for bodybuilding can experience a range of side effects. These drugs disrupt hormone production in the body and may increase estrogen. Higher levels of estrogen can cause males to develop gynecomastia, which is the enlargement of the breast glands. By reducing estrogen levels, Arimidex could prevent gynecomastia in males taking anabolic steroids. case if we would run out of stock for advertised brand, we will ship any other generic UK brand (eg. Actavis, Teva, Ranbaxy etc ) with same quality as advertised medicine. we never ship loose pills always in original blisters In case if we would run out of stock for advertised brand, we will ship any other generic brand (eg. Teva, Wockhardt, Bristol, Actavis ) with same quality as advertised medicine.",,http://torzon4dstyuo4waiwy5lgmgsqjjqcdk2pwbwdvkmg4isobc7ufbqgyd.onion/products.php?action=view&id=6571600947&pid=75631&fid=58255671088,http://torzon4dstyuo4waiwy5lgmgsqjjqcdk2pwbwdvkmg4isobc7ufbqgyd.onion/products.php?page=99&sta=1&searchword=&shipsfrom=All&payment=All&category=Pharmaceuticals&small=0&big=5000000&id=85313615311066502,2025-11-16T21:00:52+00:00,Pharmaceuticals,contraceptives,Estrogen,United Kingdom,Europe,Estrogen,contraceptives
TorZon Market,TAMOXIFEN (Nolvadex) Tamilong 20 mg 50 tabs,USD 95293.79,,4.88,,"Product Description Tamoxifen pronounced as (ta mox' i fen) Why is this medication prescribed? Tamoxifen is used to treat breast cancer that has spread to other parts of the body in men and women. It is used to treat early breast cancer in women who have already been treated with surgery, radiation, and/or chemotherapy. It is used to reduce the risk of developing a more serious type of breast cancer in women who have had ductal carcinoma in situ (DCIS a type of breast cancer that does not spread outside of the milk duct where it forms) and who have been treated with surgery and radiation. It is used to reduce the risk of breast cancer in women who are at high risk for the disease due to their age, personal medical history, and family medical history. Tamoxifen is in a class of medications known as antiestrogens. It blocks the activity of estrogen (a female hormone) in the breast. This may stop the growth of some breast tumors that need estrogen to grow. How should this medicine be used? Tamoxifen comes as a tablet to take by mouth. Tamoxifen is usually taken once or twice a day with or without food. Take tamoxifen at around the same time(s) every day. Follow the directions on your prescription label carefully, and ask your doctor or pharmacist to explain anything you do not understand. Take tamoxifen exactly as directed. Do not take more or less of it or take it more often than prescribed by your doctor. Swallow tamoxifen tablets whole do not split, chew, or crush them. Swallow the tablets with water or any other nonalcoholic drink. If you are taking tamoxifen to prevent breast cancer, you will probably take it for five years. If you are taking tamoxifen to treat breast cancer, your doctor will decide how long your treatment will last. Do not stop taking tamoxifen without talking to your doctor. If you forget to take a dose of tamoxifen, take the missed dose as soon as you remember it, and take your next dose as usual. However, if it is almost time for your next dose, skip the missed dose and continue your regular dosing schedule. Do not take a double dose to make up for a missed one. Other uses for this medicine Tamoxifen is also used sometimes to induce ovulation (egg production) in women who do not produce eggs but wish to become pregnant. Tamoxifen is also sometimes used to treat McCune-Albright syndrome (MAS a condition that may cause bone disease, early sexual development, and dark colored spots on the skin in children). Talk to your doctor about the possible risks of using this drug for your condition. This medication may be prescribed for other uses ask your doctor or pharmacist for more information. PLEASE CHECK MY VENDOR PROFILE FOR REFUND RULES. SHIPPING RESTRICTIONS AND TERMS AND CONDITIONS.",,http://torzon4dstyuo4waiwy5lgmgsqjjqcdk2pwbwdvkmg4isobc7ufbqgyd.onion/products.php?action=view&id=3593960830&pid=35599&fid=59925755617,http://torzon4dstyuo4waiwy5lgmgsqjjqcdk2pwbwdvkmg4isobc7ufbqgyd.onion/products.php?page=101&sta=1&searchword=&shipsfrom=All&payment=All&category=Pharmaceuticals&small=0&big=5000000&id=85313615311066502,2025-11-17T01:11:21+00:00,Pharmaceuticals,contraceptives,Estrogen,India,WorldWide,Estrogen,contraceptives
TorZon Market,Misoprostol 200mcg (Cytotec) 70 TABS,USD 95244.08,,4.88,,"Product Description Misoprostol Uses This medication is used to prevent stomach ulcers while you take NSAIDs (such as aspirin, ibuprofen, naproxen), especially if you are at risk for developing ulcers or have a history of ulcers. Misoprostol helps to decrease your risk of serious ulcer complications such as bleeding. This medication protects your stomach lining by lowering the amount of acid that comes in contact with it.This medication is also used in combination with another drug (mifepristone) to end a pregnancy. How to use Misoprostol This medicine comes with a patient information leaflet. Read it carefully. If you have any questions about this drug, ask your doctor, nurse, or pharmacist. Dosage is based on your medical condition and response to therapy. If you are taking this drug to prevent stomach ulcers, take it by mouth as directed by your doctor, usually four times a day. Take it after meals and at bedtime to minimize diarrhea. If you are taking this medication to end a pregnancy, take it by mouth exactly as directed by your doctor. If you are using this medication to start labor, your healthcare professional will insert it into your vagina. Avoid taking antacids that contain magnesium while using misoprostol because they may make the diarrhea it causes worse. If you need an antacid, consult your doctor or pharmacist to help you choose a product. For ulcer prevention, continue to take this drug for as long as you take NSAIDs. Use this medication regularly in order to get the most benefit from it. Remember to use it at the same times each day. Inform your doctor if your condition lasts or gets worse. PLEASE CHECK MY VENDOR PROFILE FOR REFUND RULES. SHIPPING RESTRICTIONS AND TERMS AND CONDITIONS.",,http://torzon4dstyuo4waiwy5lgmgsqjjqcdk2pwbwdvkmg4isobc7ufbqgyd.onion/products.php?action=view&id=7505421289&pid=82393&fid=44942413250,http://torzon4dstyuo4waiwy5lgmgsqjjqcdk2pwbwdvkmg4isobc7ufbqgyd.onion/products.php?page=101&sta=1&searchword=&shipsfrom=All&payment=All&category=Pharmaceuticals&small=0&big=5000000&id=85313615311066502,2025-11-17T01:12:30+00:00,Pharmaceuticals,abortion_meds,Cytotec; Mifepristone; Misoprostol,India,WorldWide,Cytotec; Mifepristone; Misoprostol,abortion_meds
TorZon Market,28 Tabs Kamagra Oral Jelly 100mg,USD 95244.08,,4.84,,"Product Description Hello dear GreenLeafDE-members, we offer you exclusive oral jelly kamagra packs for a hard, stiff night. Flavour: Orange, Vanilla, Pineapple, Strawberry, Butterscottch, Black Currant What is Kamagra Oral Jelly? Kamagra Oral Jelly is a sexual enhancer made by the Indian pharmaceutical company Ajanta Pharma. It is a generic version of Viagra, which according to the manufacturer, like the original drug, should contain the active ingredient sildenafil. Oral jelly means something like “gel to take in”. There are many different websites that sell these jellies, but the most common is Kamagra Oral Jelly. One of the alleged advantages of the jelly is that its consistency makes it easy to take without water. In addition, the natural taste is more pleasant than with tablets. It is often promised that Kamagra Oral Jelly has a preferential onset of action, since the active ingredient is absorbed directly through the oral mucosa. --------------------------------------------------- ------------------------------------------------------------ --- > Allgemeine-Infos zu uns: ---------------------------------- - Unsere Qualität und Kundenservice steht an höchster Stelle. - Faires Preis-Leistungs Verhältnis. - Unsere meisten Cannabis-Strains werden aus Holland importiert. - Wir verkaufen nur TOP Ware. - Verpackung und Versand per DHL. - Nachrichten werden innerhalb 8 Stunden beantwortet. ---------------------------------- > ADRESSFORMAT ---------------------------------- Vorname Nachname Straße Hausnummer Postleitzahl Ort Land - Schreibt bitte Umlaute in der Adresse aus. - Überprüft eure Adresse doppelt auf mögliche Rechtschreibfehler BEVOR ihr sie uns sendet. --------------------------------------------------- ----------------------------------------------------------- SMELL, TASTE AND EFFECT OF SUPER SILVER HAZE Super Silver Haze is known for its intense sweet and slightly spicy aroma. The sweet Skunk taste, earthy Haze and strong Afghani flavors of Northern Lights are magically combined. It actually tastes exactly the same as it smells, namely fantastic! With the heavy, yet sweet tasting smoke, it's no wonder this strain is so popular. The Super Silver Haze's high is functional and perfect for daytime use. You are full of energy and still feel extremely peaceful, grounded and clear in your head. The perfect strain for that morning joint. Not to forget its potential for treating headaches/migraines and anxiety. -------------------------------------------------- ------------------------------------------------------------ ---- ________________________________ > General information about us: ---------------------------------- - Our quality and customer service is our top priority. - Fair price-performance ratio. - Most of our cannabis strains are imported from Holland. - We only sell TOP merchandise. - Packaging and shipping by DHL. - Messages will be answered within 8 hours. ---------------------------------- > ADDRESS FORMAT ---------------------------------- First name Last name Street House number Zip code City Country - Please write out umlauts in the address. - Check your address twice for possible spelling mistakes BEFORE you send it to us. Meine Lichtbrüder, es gibt sonnengeküsste Nachrichten, welche eine Flut auslöse. Sicherheit: Bitte achtet immer darauf mir eure Adressen verschlüsselt zuzusenden! Hierfür solltet ihr euch mit der PGP-Verschlüsselung vertraut machen. Zwar werden die Daten bei uns in speziell dafür gemachten Betriebssystemen abgerufen ect. Trotzdem sollte euch eure Sicherheit auch wichtig sein. Versand: Beim Versand steht bei uns Sicherheit an erster Stelle. Die Ware ist vakuumiert, tast und blickdicht verpackt, sodass euch selbst bei Beschaedigung der Sendung niemand Verdacht hegen wird. Versendet wird bei uns von Montag bis Samstag. Das Adressformat ist wie folgt zu gestalten Max Mustermann Musterstrasse 123 12345 Berlin Deutschland DE= 2 Werktage EU= 3-5 Werktage Kein Tracking. (OPSec) Qualitätsversprechen unseres Shops: Da wir sehr viel Wert auf Kommunikation und Kundenservice legen, scheut euch nicht uns offene Fragen zu stellen. Normalerweise antworten wir innerhalb von 12Stunden an Werktagen. Bisher sind all unsere Sendungen angekommen und haben noch jeden glücklich gemacht. Falls das aber bei dir tatsächlich mal nicht der Fall sein sollte, wende dich bitte direkt an uns und wir finden eine Lösung. Das hilft uns beiden mehr, als das hinterlassen eines schlechten Feedbacks. Sollten jetzt noch abschließende Fragen offen geblieben sein, sind wir für dich per PM erreichbar. Reklamationen / Refund / Reship? ? Ruhe bewahren! ? Nehmt Kontakt mit uns auf und wir finden eine Möglichkeit. Wir sind auch nur Menschen. ? Refund / Reship gibt es nur, wenn ein Versäumnis unsererseits vorliegt. ? Kein Reship für Auslandssendungen. Für Neukunden gibt es leider kein Reship. ? Bestellung immer auf eigene Gefahr. ? Maximum Reship 50% Wir versuchen stets unser bestes zu geben, Versprochen! ______________________________________________ ______________ My brothers of light, there is sun-kissed news, which is causing a flood. Security: Please always make sure to send me your addresses encrypted! For this, you should familiarize yourself with PGP encryption. Although the data is retrieved from us in specially designed operating systems ect. Nevertheless, your security should also be important to you. Shipping: For shipping, security is our first priority. The goods are packed vacuumed, tast and opaque, so that even if the shipment is damaged, no one will suspect you. We ship from Monday to Saturday. The address format is as follows Max Mustermann Sample street 123 12345 Berlin Germany DE= 2 working days EU= 3-5 working days No tracking. (OPSec) Quality promise of our store: Since we put a lot of emphasis on communication and customer service, don't be afraid to ask us open questions. We usually reply within 12 hours on working days. So far, all our shipments have arrived and made everyone happy. If this is not the case for you, please contact us directly and we will find a solution. This helps both of us more than leaving a bad feedback. If you still have questions, you can reach us via PM. Complaints / Refund / Reship? ? Keep calm! ? Contact us and we will find a way. We are only human. ? Refund / Reship is only available if there is an omission on our part. ? No reship for foreign shipments. Unfortunately there is no reship for new customers. ? Order always at your own risk. ? Maximum Reship 50% After 3 years, making thousands of brothers happy on all Plattforms, we got News ! there is a maximum reship of 30 to 50 percent. and only in the case of sympathy. (with cocaine there is no reship/refund)!!! UPDATE 01.10.2022 We always try our best to give, promised!",,http://torzon4dstyuo4waiwy5lgmgsqjjqcdk2pwbwdvkmg4isobc7ufbqgyd.onion/products.php?action=view&id=7762920099&pid=4453&fid=9754038268,http://torzon4dstyuo4waiwy5lgmgsqjjqcdk2pwbwdvkmg4isobc7ufbqgyd.onion/products.php?page=102&sta=1&searchword=&shipsfrom=All&payment=All&category=Pharmaceuticals&small=0&big=5000000&id=85313615311066502,2025-11-17T01:13:05+00:00,Pharmaceuticals,contraceptives,Advantage S,Germany,WorldWide,Advantage S,contraceptives
